{
 "schemaVersion": 1,
 "guildId": "golden",
 "from": "2026-10-04T18:00:00.000Z",
 "to": "2026-10-11T18:00:00.000Z",
 "plays": 87,
 "skips": 9,
 "autoplayPlays": 52,
 "listenedSeconds": 18900,
 "topTracks": [
  {
   "title": "Track 1",
   "author": "Artist 1",
   "plays": 30,
   "cover": "iVBORw0KGgoAAAANSUhEUgAAAAgAAAAICAIAAABLbSncAAAAEUlEQVR4nGPY4fsBK2IYWhIA4ph9QRrlge0AAAAASUVORK5CYII="
  },
  {
   "title": "Track 2",
   "author": "Artist 2",
   "plays": 29
  },
  {
   "title": "Track 3",
   "author": "Artist 3",
   "plays": 28
  },
  {
   "title": "Track 4",
   "author": "Artist 4",
   "plays": 27,
   "cover": "iVBORw0KGgoAAAANSUhEUgAAAAgAAAAICAIAAABLbSncAAAAEUlEQVR4nGM4X/MNK2IYWhIAU1CQQZUKojEAAAAASUVORK5CYII="
  },
  {
   "title": "Track 5",
   "author": "Artist 5",
   "plays": 26
  },
  {
   "title": "Track 6",
   "author": "Artist 6",
   "plays": 25
  },
  {
   "title": "Track 7",
   "author": "Artist 7",
   "plays": 24,
   "cover": "iVBORw0KGgoAAAANSUhEUgAAAAgAAAAICAIAAABLbSncAAAAEUlEQVR4nGPIk5qHFTEMLQkArGxJgebegqQAAAAASUVORK5CYII="
  },
  {
   "title": "Track 8",
   "author": "Artist 8",
   "plays": 23
  },
  {
   "title": "Track 9",
   "author": "Artist 9",
   "plays": 22
  }
 ],
 "topArtists": [
  {
   "name": "Artist 1",
   "plays": 14
  }
 ]
}
