{
 "schemaVersion": 1,
 "guildId": "golden",
 "from": "2026-10-04T18:00:00.000Z",
 "to": "2026-10-11T18:00:00.000Z",
 "plays": 87,
 "skips": 9,
 "autoplayPlays": 52,
 "listenedSeconds": 18900,
 "topTracks": [
  {
   "title": "夜に駆ける",
   "author": "YOASOBI",
   "plays": 9,
   "cover": "iVBORw0KGgoAAAANSUhEUgAAAAgAAAAICAIAAABLbSncAAAAEUlEQVR4nGPY4fsBK2IYWhIA4ph9QRrlge0AAAAASUVORK5CYII="
  },
  {
   "title": "أغنية عربية جميلة",
   "author": "فيروز",
   "plays": 6,
   "cover": "iVBORw0KGgoAAAANSUhEUgAAAAgAAAAICAIAAABLbSncAAAAEUlEQVR4nGP4diIeK2IYWhIA/pSHQb8CW6QAAAAASUVORK5CYII="
  },
  {
   "title": "Love song אהבה (Remix)",
   "author": "עומר אדם",
   "plays": 5
  },
  {
   "title": "Emoji 🎵 & <tags> \"q\"",
   "author": "周杰倫 feat. Кино",
   "plays": 4,
   "cover": "iVBORw0KGgoAAAANSUhEUgAAAAgAAAAICAIAAABLbSncAAAAEUlEQVR4nGM4X/MNK2IYWhIAU1CQQZUKojEAAAAASUVORK5CYII="
  }
 ],
 "topArtists": [
  {
   "name": "Artist 1",
   "plays": 14
  }
 ]
}
